Story,StoryId,Explanatory,Response,Observed Confounding,Unobserved Confounding"300 men and 300 women are taken for an experiment of a new weight loss drug. The drug is administered to the men and a placebo is administered to women, and after a month the men experienced more weight loss than women.",StoryId1,Drug Administered,Weight loss,Gender,Fitness Level" In a new experiment at a laboratory, 100 males will be going through testing for the effects of a vegetarian diet on muscle growth. The men are allowed to eat anything they want as long as it is not meat. After two months, all of the men are studied to see if they became more muscular.",StoryId2,Diet,Muscle Growth,Foods consumed,Genetics for muscle mass"A team of veterinarians are comparing the effectiveness of fertility treatments on tigers. The two treatments are in-vitro fertilization and male fertility medications. The medications are distributed with 5 tigers getting in-vitro fertilizations and 15 tigers getting male fertility medications, because in-vitro is expensive.",StoryId3,Fertility Treatment,Fertility Rates,# of tigers in each group,Age of fertility in tigers"A group 16 college kids are looking into how two different study habits influence their grade on their next Calculus exam. Eight of the kids will study for 12 hours the day before the exam, while eight of the kids will study for 2 hours a day for 5 days before the exam. They plan to compare the average grade between the two groups after the exam.",StoryId4,Study Technique,Grade on exam,Hours spent studying,Intelligence level of the kids"A truck driving company wanted to examine whether they would save more money on fuel if they used gasoline or diesel trucks. The company decided to examine 10 of their diesel fueled trucks on the east coast of the United States, and 10 of their gasoline fueled trucks on the west coast of the United States. After one month, they examined the cost of fuel for each truck and compared the two.",StoryId5,Fuel Type,Cost of Fuel,Location in the United States,Speed the drivers drive"Around Halloween, a dentist decided he wanted to experiment with a new brand of cavity reducing toothpaste. He took ten of his teenager patients and gave 5 of them the cavity reducing toothpaste and 5 of them normal toothpaste. He told the cavity reducing tooth paste to brush once a day, and the other group to brush twice a day. A month later he recorded which group on average had more cavities.",StoryId6,Tooth paste type,Amount of cavities,Times brushing teeth a day,Halloween Candy Surplus